license,business_name,address,city,cit_latest_date,cit_ice_count,last_disposition,cit_repeat,cit_corrected_on_site,best_observation
6213587,ARBY'S #156,40972 US 19 N,TARPON SPRINGS,2026-02-03,3,Inspection Completed - No Further Action,True,False,Raw animal food stored over/not properly separated from ready-to-eat food. Raw chicken and fish over ready to eat fried in reach in freezer. Operator moved fish and chicken to proper area.
6213589,BELLEAIR CAFE,2601 JEWEL RD,BELLEAIR BLUFFS,2021-03-15,1,Inspection Completed - No Further Action,False,False,
6213591,THE BAYOU CAFE,118 E TARPON AVE,TARPON SPRINGS,2026-04-02,15,Emergency order recommended,True,False,"No plan review submitted and approved - renovations were made or are in progress. Must submit plans and plan review application to DBPR H and R Plan Review office located at 2601 Blair Stone Rd., Tallahassee, FL 32399-1011. Plans must be submitted AND approved within 60 days. The direct link to the…"
6213612,REGENCY OAKS ILF SOUTH,2701 REGENCY OAKS BLVD.,CLEARWATER,2026-04-24,5,Warning Issued,True,False,Raw/undercooked animal food offered and establishment has no written consumer advisory. Raw animal foods must be fully cooked prior to service.manager posted consumer advisory in dining area .
6213618,THREE BIRDS TAVERN,1492 4 ST N,ST PETERSBURG,2025-09-26,6,Warning Issued,True,False,Cooked/heated time/temperature control for safety food not cooled from 135 degrees Fahrenheit to 70 degrees Fahrenheit within two hours and from 135 degrees Fahrenheit to 41 degrees Fahrenheit within six hours. See stop sale. Inside stand alone reach-in cooler on West side of kitchen: Mashed potato…
6213619,KINNEY'S KITCHEN,3050 DREW ST,CLEARWATER,2021-04-24,1,Administrative complaint recommended,False,False,
6213626,SEMINOLE SUBS & GYROS,2298 MAIN ST,CLEARWATER,2024-04-23,3,Warning Issued,True,False,
6213630,TACO BELL #17693,40976 N US HWY 19,TARPON SPRINGS,2025-09-04,3,Inspection Completed - No Further Action,True,False,Accumulation of black/grey mold-like substance in the interior of the ice chute and around nozzles in lobby. Around nozzles of ice machine
6213638,HUNGRY HOWIES,1884 DREW ST,CLEARWATER,2020-11-09,2,Call Back - Complied,True,False,
6213641,DUNEDIN'S CRICKETERS,2634 BAYSHORE BLVD,DUNEDIN,2026-04-28,8,Inspection Completed - No Further Action,True,False,Raw animal food stored over/not properly separated from ready-to-eat food. Metal container of Raw beef over ready to eat mixed vegetables in reach in freezer by front of cook line. Operator moved container. Raw burger over onion ring batter in walk In cooler. Raw chicken over container of onions in…
6213648,CARIBBEAN CAFE,4801 CENTRAL AVE,ST PETERSBURG,2025-10-27,2,Administrative complaint recommended,True,False,"Ready-to-eat, time/temperature control for safety food prepared onsite and held more than 24 hours not properly date marked. Prepared sofrito (garlic and oil base) in reach-in cooler not date marked."
6213652,GINO NY STYLE PIZZERIA REST,35977 US HWY 19,PALM HARBOR,2021-02-23,3,Inspection Completed - No Further Action,True,False,
6213654,DERUSSO'S PIZZERIA,1120 PINELLAS BAYWAY S UNIT 102-103,TIERRA VERDE,2025-10-02,4,Inspection Completed - No Further Action,True,False,"Food-contact surface soiled with food debris, mold-like substance or slime. Cutting boards on prep table in kitchen soiled with debris between cracks."
6213655,BILLY'S STONECRAB STEAKHOUSE,1 COLLANY RD,TIERRA VERDE,2026-03-31,6,Inspection Completed - No Further Action,True,False,Warewashing sanitizing solution exceeding the maximum concentration allowed Warewashing solution in time/temperature control for safety at or exceeds 500 ppm. Employee began to empty sink and corrected solution.
6213659,PAN FILOS,656 S GULFVIEW BLVD,CLEARWATER,2026-05-14,4,Inspection Completed - No Further Action,True,False,"Commercially processed ready-to-eat, time/temperature control for safety food opened and held more than 24 hours not properly date marked after opening. Milk ."
6213665,OUR PLACE,1101 S MISSOURI AVE,CLEARWATER,2026-02-20,3,Inspection Completed - No Further Action,True,False,Cold holding equipment not maintained in good repair. Do not store time/temperature control for safety food in this unit until the unit is repaired. Walk in cooler alarmed at 6:00 am. Operator has placed service call. Ambient temperature reads 55F at 10:30am. All the foods removed and placed in…
6213678,NIAGARA TAP,11950 SEMINOLE BLVD,LARGO,2026-02-18,5,Inspection Completed - No Further Action,True,False,"Nonfood-contact surface soiled with grease, food debris, dirt, slime or dust. Exterior of pizza ovens soiled. Exterior of soap dispenser next to ice machine soiled Hood filters soiled over cook line"
6213686,DOE DOES DINER,9395 BAY PINES BLVD,ST. PETERSBURG,2026-02-04,4,Inspection Completed - No Further Action,True,False,"Employee handled soiled equipment or utensils and then engaged in food preparation, handled clean equipment or utensils, or touched unwrapped single-service items without washing hands. Observed employee touching dirty dishes and then switched to touching clean dishes."
6213689,CORNER BAR & GRILL,2116 E BAY DR,LARGO,2022-09-19,4,Inspection Completed - No Further Action,True,False,
6213690,TUTTO ROSSO,7863 BLIND PASS RD,ST.PETE BEACH,2026-04-16,6,Warning Issued,True,False,Establishment has no written procedures for employees to follow in response to a vomiting or diarrheal event where the vomit or diarrhea is discharged onto surfaces in the establishment. Emailed person in charge DBPR Clean-Up of Vomiting and Diarrheal Events form.
6213692,SCULLEY'S,190 JOHN'S PASS BOARDWALK,MADEIRA BEACH,2021-03-10,2,Inspection Completed - No Further Action,True,False,
6213695,BOSTON MARKET #859,7820 N 113 ST,SEMINOLE,2021-01-07,1,Inspection Completed - No Further Action,False,False,
6213699,METRO DELI,28100 US 19 N STE 103,CLEARWATER,2026-03-19,2,Inspection Completed - No Further Action,True,False,Employee touching ready-to-eat food with their bare hands - food was not being heated as a sole ingredient to 145 degrees F or immediately added to other ingredients to be cooked/heated to the minimum required temperature to allow bare hand contact. Establishment has no approved Alternative…
6213719,DELECTABLES FINE CATERING,969 VIRGINIA AVE,PALM HARBOR,2021-01-26,4,Warning Issued,True,False,
6213745,GAMBINOS PIZZA OF PALM HARBOR,31808 US HWY 19 N,PALM HARBOR,2026-05-13,6,Warning Issued,True,False,"Food-contact surface soiled with food debris, mold-like substance or slime."
6213750,TIERRA VERDE SUBWAY #18555,130 PINELLAS BAYWAY,TIERRA VERDE,2023-09-25,1,Inspection Completed - No Further Action,False,False,
6213751,SLICE OF THE BURG,10484 ROOSEVELT BLVD,ST. PETERSBURG,2025-08-06,4,Inspection Completed - No Further Action,True,False,Time/temperature control for safety food cold held at greater than 41 degrees Fahrenheit. Near pizza prep station. garlic with minced fresh garlic (82F - Cold Holding) Talked to establishment about putting on time as a public health control or using different products. Educated
6213761,SUBWAY SANDWICHES & SALADS,2655 E BAY DR,LARGO,2020-10-30,1,Inspection Completed - No Further Action,False,False,
6213769,KOOKY COCONUT CAFÉ,760 GULF BLVD,INDIAN ROCKS BEACH,2021-01-05,1,Inspection Completed - No Further Action,False,False,
6213774,CARINOS ITALIAN RESTAURANT,9524 BLIND PASS ROAD SUITE 5-11,ST. PETE BEACH,2026-01-08,5,Inspection Completed - No Further Action,True,False,"No proof of required state approved employee training provided for any employees. To order approved program food safety material, call DBPR contracted provider: Florida Restaurant and Lodging Association (SafeStaff) 866-372-7233."
6213777,OVERTIME,1969 SUNSET POINT ROAD,CLEARWATER,2026-04-08,2,Inspection Completed - No Further Action,True,False,"Required employee training expired for some employees. To order approved program food safety material, call DBPR contracted provider: Florida Restaurant and Lodging Association (SafeStaff) 866-372-7233. Deborah and Jackie training expired 2/24/26 . Other employees are current"
6213788,THE BAWARCHIE INDIAN CUISINE,34832 US HWY 19 N,PALM HARBOR,2020-11-18,1,Inspection Completed - No Further Action,False,False,
6213800,CERTEGY CAFE,11601 ROOSEVELT BLVD,ST. PETERSBURG,2021-02-03,2,Inspection Completed - No Further Action,True,False,
6213809,PHO KIEN GIANG ,8730 49 ST N UNIT 13,PINELLAS PARK,2025-02-10,6,Warning Issued,True,False,
6213810,MCDONALD'S #17817,1934 N HERCULES AVE,CLEARWATER,2026-05-11,2,Inspection Completed - No Further Action,True,False,
6213822,TACO BELL #18575,5210 S 34 ST,ST PETERSBURG,2023-05-08,3,Warning Issued,True,False,
6213837,ALMA LLANERA VENEZUELAN FOOD,6571 102 AVE N,PINELLAS PARK,2024-01-31,4,Warning Issued,True,False,
6213838,ITALIAN TOUCH MAMMAROSA INC,8211 46 AVE N,ST. PETERSBURG,2025-12-10,5,Warning Issued,True,False,"Food manager certification expired. A list of accredited food manager certification examination providers can be found at https://www2.myfloridalicense.com/hotels-restaurants/food-lodging/food-manager/ Operator Nicola Carbone CFM expired 3/6/24, other staff with valid CFM present"
6213839,THAI RAMA 9,17807 GULF BLVD,REDINGTON SHORES,2024-09-10,5,Inspection Completed - No Further Action,True,False,
6213848,DOMINO'S 5027,12613 ULMERTON RD,LARGO,2026-03-19,1,Inspection Completed - No Further Action,False,False,Interior of oven/microwave has accumulation of black substance/grease/food debris.
6213851,THE DRUNKEN CLAM,46 46 AVE,ST.PETE BEACH,2026-01-21,5,Inspection Completed - No Further Action,True,False,Commercially processed reduced oxygen packaged fish bearing a label indicating that it is to remain frozen until time of use no longer frozen and not removed from reduced oxygen package. (16) 4oz portions of yellowfin tuna (3) 4oz portions of salmon (4) 4oz portions of mahi mahi Located in reach-in…
6213852,MARQUISE CAFE,2525 PASADENA S AVE STE C ET D,SOUTH PASADENA,2021-02-18,2,Inspection Completed - No Further Action,True,False,
6213857,AMICI ITALIAN EATERY,1901 W BAY DR S VILLAGE PLA,LARGO,2025-12-05,3,Inspection Completed - No Further Action,True,False,"Commercially processed ready-to-eat, time/temperature control for safety food opened and held more than 24 hours not properly date marked after opening. Sliced deli ham ."
6213871,MJ'S WATERING HOLE,"5501 GULF BLVD, SUITE 108",ST. PETERSBURG BEACH,2026-04-07,3,Inspection Completed - No Further Action,True,False,Interior of oven/microwave has accumulation of black substance/grease/food debris. Interior of microwave soiled with food debris.
6213874,BAYSIDE BAR & GRILL,20967 US 19 N,CLEARWATER,2025-08-07,3,Warning Issued,True,False,Opened employee beverage container in a cold holding unit with food to be served to customers in front line area . Manager discarded employee open bottle of water
6213883,HABANA CAFE,5402 GULFPORT BLVD,GULFPORT,2025-10-10,4,Inspection Completed - No Further Action,True,False,"Dead roaches on premises. 1 dead roach behind laundry room door 1 dead roach next to mop sink 2 dead roaches on floor near end of dry storage area ""junk room"" 1 dead roach in upstairs wait station area 1 dead roach in upstairs dining area 1 dead roach in upstairs large storage room 5 dead roaches…"
6213886,NORI THAI RESTAURANT,7612 BLIND PASS RD,ST.PETE BEACH,2026-04-17,6,Warning Issued,True,False,"Commercially processed ready-to-eat, time/temperature control for safety food opened and held more than 24 hours not properly date marked after opening. Container of half and half in front reach-in cooler opened over 24 hours ago not date marked. Operator date marked item."
6213894,FOXY'S CAFE,160 107 AVE,TREASURE ISLAND,2025-09-23,5,Warning Issued,True,False,"In-use utensil not stored with handle above the top of time/temperature control for safety food and rim of the container. Cooked peppers and onions, corned beef hash."
6213896,PHILLY'S,4375 E BAY DR,CLEARWATER,2020-12-10,2,Inspection Completed - No Further Action,True,False,
6213901,BACKFIN BLUE CAFE,2913 BEACH BLVD,GULF PORT,2026-04-15,4,Inspection Completed - No Further Action,True,False,"Commercially processed ready-to-eat, time/temperature control for safety food opened and held more than 24 hours not properly date marked after opening. Half and half in reach in cooler behind bar opened on Sunday not date marked. Operator date marked."
6213902,ACROPOL FAMILY RESTAURANT,1170 STARKEY RD,LARGO,2026-04-02,6,Inspection Completed - No Further Action,True,False,Dead roaches on premises. 22 total dead roaches. -1 dead floor front of expo -1 dead under reach in cooler -1 dead floor under cook line -1 dead floor under wire shelf with metal pans next to cook lineline -13 dead floor under 3 compartment sink -5 dead under shelves in dry storage Operator cleaned…
6213903,BEACH BIRDS BEACH BAR ,655 S GULFVIEW BLVD,CLEARWATER BEACH,2025-07-07,2,Inspection Completed - No Further Action,True,False,"No plan review submitted and approved - renovations were made or are in progress. Must submit plans and plan review application to DBPR H and R Plan Review office located at 2601 Blair Stone Rd., Tallahassee, FL 32399-1011. Plans must be submitted AND approved within 60 days. The direct link to the…"
6213909,ALFANO'S RESTAURANTS,1702 CLEARWATER LARGO RD,CLEARWATER,2026-04-30,4,Warning Issued,True,False,
6213912,THE LUCKY DILL,33180 N US HWY 19,PALM HARBOR,2025-12-05,5,Administrative complaint recommended,True,False,Employee drinking from an unenclosed beverage container in a food preparation/clean dishware area and the container does not have a dispensing mechanism to prevent hand contact with lip contact area of drink container. Employee on salad station prepping food drinking from open water cup.
6213913,CAFE 19,12500 VONN ROAD,LARGO,2025-11-06,1,Inspection Completed - No Further Action,False,False,"Employee failed to wash hands before putting on gloves to initiate a task working with food. Staff observed using cash register, then proceeded to put on gloves to handle hot dogs without washing hands, discussed proper procedures with staff"
6213914,ACROPOLIS,515 CENTRAL AVE,ST PETERSBURG,2021-05-21,6,Warning Issued,True,False,
6213920,MID PENINSULA SEAFOOD,400 49TH ST. S,ST. PETERSBURG,2026-03-25,8,Call Back - Complied,True,False,- From initial inspection : High Priority - Raw animal food stored over/not properly separated from ready-to-eat food. -raw shell eggs stored over sour cream in 2 door reach in cooler in kitchen -raw burger patties stored over cooked wings in 2 door reach in cooler in kitchen Operator moved both…
6213941,PAPA JOHN'S PIZZA,411 S MISSOURI AVE,CLEARWATER,2024-12-10,1,Inspection Completed - No Further Action,False,False,
6213943,CICI'S PIZZA,4743 66  ST  N,KENNETH CITY,2025-12-30,3,Inspection Completed - No Further Action,True,False,Time/temperature control for safety food cold held at greater than 41 degrees Fahrenheit. shredded cheddar (46F - Cold Holding); cooked beef (46F - Cold Holding); diced ham (46F - Cold Holding); pizza sauce from can (water added) (53F - Cold Holding); cut tomatoes (51F - Cold Holding); cooked pasta…
6213946,WENDY'S PROPERTIES LLC,23072 US 19 N,CLEARWATER,2020-11-10,2,Warning Issued,True,False,
6213949,SALT ROCK GRILL,19325 GULF BLVD,INDIAN SHORES,2026-03-24,4,Inspection Completed - No Further Action,True,False,"Cooked/heated time/temperature control for safety food not cooled from 135 degrees Fahrenheit to 70 degrees Fahrenheit within 2 hours. Seafood gravy made on 3/23/26 at 45f, found at inspection. Item discarded."
6213950,PO FOLKS RESTAURANT,2001 34 ST N,ST PETERSBURG,2025-10-29,5,Inspection Completed - No Further Action,True,False,"Commercially processed ready-to-eat, time/temperature control for safety food opened and held more than 24 hours not properly date marked after opening. Container of milk opened two days prior not date marked. Manager wrote date on container."
6213956,PIEROGI BAR ST PETE,6661 CENTRAL AVE,ST. PETERSBURG,2026-05-06,6,Inspection Completed - No Further Action,True,False,"Food-contact surface soiled with food debris, mold-like substance or slime."
6213959,FEATHER SOUND COUNTRY CLUB,2201 FEATHER SOUND DR,CLEARWATER,2026-04-09,4,"Call Back - Extension given, pending",True,False,
6213960,GIGI'S ITALIAN RESTAURANT,4399 GULF BLVD,ST PETE BCH,2020-12-18,1,Inspection Completed - No Further Action,False,False,
6213963,CEVICHE TAPAS BAR AND RESTAURANT,332 BEACH DR NE,ST. PETERSBURG,2026-03-03,6,Inspection Completed - No Further Action,True,False,Employee failed to wash hands before putting on gloves to initiate a task working with food. Employee touched raw animal foods and took his gloves off but didn't wash his hands before putting on a new pair and began cooking on the cook line and touching clean plates. Chef educated employee and…
6213973,TSUNAMI JAPANESE STEAKHOUSE,2176 TYRONE BLVD,ST. PETERSBURG,2021-04-01,3,Emergency order recommended,True,False,
6213977,SUSHI SPOT & NOODLE WORLD,3665 E BAY DR #146,LARGO,2025-01-03,3,Inspection Completed - No Further Action,True,False,
6213987,NATURE'S TABLE CITY CENTER,100 2 AVE S,SAINT PETERSBURG,2023-03-29,2,Warning Issued,True,False,
6213998,STARLITE CAFE,1336 MAIN ST,DUNEDIN,2026-04-14,5,Warning Issued,True,False,Dead roaches on premises. 3 dead in storage room 2 under refrigerator in kitchen 1 roach egg sack on tray in storage room. 2 roach egg sacks on plate in storage room 47 egg sacks under shelves in storage room 6 egg sacks on floor between fridge and fryer 4 by chemical cart in back of kitchen
6214001,STROKERS,30901 US HWY 19 N,PALM HARBOR,2026-04-23,8,Warning Issued,True,False,"Certified Food Manager or person in charge lacks knowledge of foodborne illnesses and symptoms of illness that would prevent an employee from working with food, clean equipment and utensils, and single-service items. Person in charge had no knowledge of big six food borne illnesses. Provided…"
6214005,CHECKERS DRIVE IN #1067,1610 MCMULLEN BOOTH RD,CLEARWATER,2022-08-08,1,Inspection Completed - No Further Action,False,False,
6214007,OZONA BLUE GRILLING COMPANY,125 ORANGE ST SOUTH,PALM HARBOR,2026-01-05,6,Inspection Completed - No Further Action,True,False,Establishment has no written procedures for employees to follow in response to a vomiting or diarrheal event where the vomit or diarrhea is discharged onto surfaces in the establishment. Provided operator with form HR 5030-104.
6214014,BERNIE'S PLACE, 3135 18TH AVE SOUTH,SAINT PETERSBURG,2026-04-01,5,Inspection Completed - No Further Action,True,False,"Time/temperature control for safety food, other than whole meat roast, hot held at less than 135 degrees Fahrenheit. From front counter steam table at 1:02pm. Operator turned steam table temperature up. Rechecked temps. a. cooked rice (125F - Hot Holding); 137f b. cooked corn (131F - Hot Holding)…"
6214021,STEAK N SHAKE,10555 ULMERTON RD,LARGO,2025-11-10,3,Inspection Completed - No Further Action,True,False,Observed: Food service manager not certified within 30 days of employment. A list of accredited food manager certification examination providers can be found at http://www.myfloridalicense.com/DBPR/hotels-restaurants/food-lodging/food-manager/ Manager on duty is Doug Metzger Priority: Intermediate
6214022,YOUR WAY CAFE,17757 US 19 N STE 190,CLEARWATER,2026-02-09,4,Inspection Completed - No Further Action,True,False,"Required employee training expired for some employees. To order approved program food safety material, call DBPR contracted provider: Florida Restaurant and Lodging Association (SafeStaff) 866-372-7233. One employee certificate expired"
6214028,BAN THAI & SUSHI INC,2519 MCMULLEN BOOTH RD #506,CLEARWATER,2026-03-25,4,Inspection Completed - No Further Action,True,False,Employee touching ready-to-eat food with their bare hands - food was not being heated as a sole ingredient to 145 degrees F or immediately added to other ingredients to be cooked/heated to the minimum required temperature to allow bare hand contact. Establishment has no approved Alternative…
6214033,MCDONALD'S #21034,29978 US 19 N,CLEARWATER,2024-08-27,1,Inspection Completed - No Further Action,False,False,
6214034,BAMBINO PIZZA,2028 BAY SHORE BLVD,DUNEDIN,2026-01-08,2,Call Back - Complied,True,False,Time/temperature control for safety food identified in the written procedure as a food held using time as a public health control has no time marking and the time removed from temperature control cannot be determined. See stop sale. Pizza slices not time stamped. Person in charge time stamped pizza…
6214048,SAND BAR & GRILL,400 MANDALAY AVE,CLEARWATER,2026-04-15,1,Warning Issued,False,False,
6214049,SHARKY'S SEA PUB,19703  GULF BLVD,INDIAN SHORES,2025-10-21,2,Warning Issued,True,False,"No proof of required state approved employee training provided for any employees. To order approved program food safety material, call DBPR contracted provider: Florida Restaurant and Lodging Association (SafeStaff) 866-372-7233."
6214054,SHAKE SHOP,11920 GULF BLVD,TREASURE ISLAND,2020-09-04,1,Warning Issued,False,False,
6214063,HALONG BAY VIETNAMESE CUISINE,5944 34 ST N. STE 39-43,ST. PETERSBURG,2025-09-30,15,Inspection Completed - No Further Action,True,False,"Nonfood-contact surface soiled with grease, food debris, dirt, slime or dust. Shelves across from cookline, above reach-in cooler, soiled heavily with grease. Exterior of cooking equipment heavily soiled Gaskets soiled on reach-in cooler units through establishment Handwash sink located at cookline…"
6214065,THE VINOY RENAISSANCE ST PETERSBURG RESORT & GC SUNSET BALLROOM,600 NE SNELL ISLE BLVD,ST. PETERSBURG,2025-11-06,3,Inspection Completed - No Further Action,True,False,"Standing water or very slow draining water in handwash sink, three-compartment sink, or mop sink. Standing water at dish pit drain."
6214066,APPLEBEES NEIGHBORHOOD GRILL & BAR,1465 MCMULLEN BOOTH RD,CLEARWATER,2026-05-05,6,Inspection Completed - No Further Action,True,False,
6214072,PAPA JOHN'S PIZZA,1098 OVERCASH DR,DUNEDIN,2020-10-26,1,Inspection Completed - No Further Action,False,False,
6214073,STEAK N SHAKE,2490 SR 580,CLEARWATER,2026-01-26,4,Warning Issued,True,False,Employee with no beard guard/restraint while engaging in food preparation. 2 employees with beards no beard guards. Discussed the importance of of wearing beard guards when involved in food preparation
6214077,PAULS'S CHICAGO PIZZA,1500 MCMULLEN BOOTH RDA11,CLEARWATER,2025-12-19,3,Inspection Completed - No Further Action,True,False,"Stored food not covered . Pizza dough panned on cart uncovered , stored in walkway area in kitchen . Manager covered pizza and relocated cart"
6214084,FAMOUS GREEK SALADS & SANDWICHES,2508 A MCMULLEN BOOTH RD,CLEARWATER,2025-07-14,2,Inspection Completed - No Further Action,True,False,"Time/temperature control for safety food cold held at greater than 41 degrees Potato salad 46F cold hold, cut tomatoes 50Fcold hold, Lettuce 46F cold hold. All food was brought up to the line from other coolers less than 4 hours ago. Staff placing food on ice."
6214093,PAPA JOHNS PIZZA,18378 HWY 19 N,CLEARWATER,2024-04-04,1,Inspection Completed - No Further Action,False,False,
6214103,LONGHORN STEAKHOUSE OF LARGO,5375 EAST BAY DRIVE,LARGO,2023-11-06,5,Inspection Completed - No Further Action,True,False,
6214105,JOE'S CRAB SHACK,2730 GULF TO BAY BLVD,CLEARWATER,2024-03-12,6,Inspection Completed - No Further Action,True,False,
6214115,COUNTRY PIZZA ITALIAN GRILL,14820 US HWY 19 N,CLEARWATER,2026-01-15,7,Warning Issued,True,False,"Operator is not properly tracking/marking the number of days ready-to-eat, time/temperature control for safety food prepared onsite was held at refrigeration temperatures prior to freezing in order to properly date mark the food when it is thawed and held at refrigeration temperatures again.…"
6214116,FRANK'S PIZZA,1600 VIRGINIA ST,DUNEDIN,2026-05-01,11,Administrative complaint recommended,True,False,
6214120,MAMAS GREEK CUISINE,735 DODECANESE BLVD40&41,TARPON SPRINGS,2026-05-04,7,Inspection Completed - No Further Action,True,False,Time/temperature control for safety food cold held at greater than 41 degrees Fahrenheit. In walk in cooler - raw ground beef logs (44F - Cold Holding); raw chicken (45F - Cold Holding); pastiso (45F - Cold Holding); moss aka (45F - Cold Holding); spanakopita (46F - Cold Holding) operator states…
6214128,DAYDREAMERS CAFE AND GRILL,143 7 AVE N,SAFETY HARBOR,2025-01-30,4,Inspection Completed - No Further Action,True,False,
6214139,TJ'S GOURMET PIZZA CAFE,1515 GULF BLVD,INDIAN ROCKS BCH,2021-05-26,2,Warning Issued,True,False,
6214146,NORTONS BAR & GRILL,1824 MAIN ST,DUNEDIN,2025-12-19,3,Inspection Completed - No Further Action,True,False,Spray bottle containing toxic substance not labeled. Of light yellow liquid substance stored on chemical rack across from mop sink. Operator labeled as degreaser.
6214149,SARKU JAPAN,27001 HWY 19 N  SPACE 2087,CLEARWATER,2026-04-17,6,Inspection Completed - No Further Action,True,False,In-use utensil not stored with handle above the top of time/temperature control for safety food and rim of the container. Observed tongs in bulk pasta on cooks line at time of inspection. Operator removed tongs to be washed.
6214154,HOG ISLAND FISH CAMP,900 BROADWAY,DUNEDIN,2021-01-20,2,Inspection Completed - No Further Action,True,False,
6214155,BARFLY - FISH SHACK BAR & GRILL,1026 NEBRASKA  AVE,PALM HARBOR,2026-01-08,4,Warning Issued,True,False,"Employee personal items stored in or above a food preparation area, food, clean equipment and utensils, or single-service items. Employee keys on bar area, employee cell phones on shelf above prep table across from reach in coolers. Employee helmet above soda boxes in back of kitchen. Operator…"
6214163,CHINA MAX,27001 US 19 N #2092,CLEARWATER,2020-08-17,1,Inspection Completed - No Further Action,False,False,
