license,business_name,address,city,cit_latest_date,cit_ice_count,last_disposition,cit_repeat,cit_corrected_on_site,best_observation
6217791,PACIFIC COUNTER,660  CENTRAL AVE,SAINT PETERSBURG,2025-10-29,4,Inspection Completed - No Further Action,True,False,Food service manager not certified within 30 days of employment. A list of accredited food manager certification examination providers can be found at http://www.myfloridalicense.com/DBPR/hotels-restaurants/food-lodging/food-manager/ Vivian R. General Manager on site at the time of routine…
6217792,LEFT BANK BISTRO,1225 MARTIN LUTHER KING JR ST N,ST. PETERSBURG,2024-11-13,5,Inspection Completed - No Further Action,True,False,
6217793,LIBRARY JV MANAGEMENT LLC & FOR ALL KIDS LLC,600 5 ST S,ST. PETERSBURG,2026-04-22,6,Inspection Completed - No Further Action,True,False,Chlorine sanitizer not at proper minimum strength for manual warewashing. Three compartment sink Quaternary sanitizer testing at 0 PPM. Three compartment sink was manually set up with quaternary sanitizer and the chemical is now testing at 200 PPM.
6217796,BENTO CAFE,320 3 ST S,ST PETERSBURG,2025-11-03,4,Inspection Completed - No Further Action,True,False,"Time/temperature control for safety food, other than whole meat roast, hot held at less than 135 degrees Fahrenheit. miso soup (133F - Hot Holding) Discussed the reheating process for soup and verifying that it reaches 165 degrees or above. The temperature was not checked during reheating. Employee…"
6217800,SOUTHIE COFFEE ,1500 S MISSOURI AVE,CLEARWATER,2026-01-08,3,Inspection Completed - No Further Action,True,False,- From initial inspection : Basic - Accumulation of black/pink mold-like substance in the interior of the ice machine/bin. Ice machine in kitchen as well as ice bin at front counter have accumulation of mold like substance and debris. - From follow-up inspection 2025-09-02: Ice machine in kitchen…
6217801,CALIDOLI,7580 49 ST N,PINELLAS PARK,2026-03-25,7,Inspection Completed - No Further Action,True,False,"Time/temperature control for safety food, other than whole meat roast, hot held at less than 135 degrees Fahrenheit. Front counter inside hot holding unit. pig ears (85F - Hot Holding) Front buffets cooked shrimp (90F - Hot Holding); cooked whole tilapia (76F - Hot Holding); cooked chicken teriyaki…"
6217802,SEKUSHI SUSHI DUMPLING AND NOODLE BAR,524 MANDALAY AVE,CLEARWATER,2024-12-16,3,Inspection Completed - No Further Action,True,False,
6217803,DR. BBQ,1101 1ST AVE SOUTH,ST PETERSBURG,2021-04-21,3,Call Back - Admin. complaint recommended,True,False,
6217804,POKE FUN,2727 ULMERTON RD  STE 110,CLEARWATER,2022-08-09,3,Inspection Completed - No Further Action,True,False,
6217805,SUMO HIBACHI EXPRESS,6975 66TH ST N,PINELLAS PARK,2025-10-16,1,Warning Issued,False,False,Time/temperature control for safety food identified in the written procedure as a food held using time as a public health control has no time marking and the time removed from temperature control cannot be determined. Sticky rice in red cooler no time stamp
6217806,FIRST STREET COFFEE COMPANY,333 1 ST S,ST. PETERSBURG,2025-09-17,3,Inspection Completed - No Further Action,True,False,Pesticide-emitting strip present in food prep area. Hanging over bags of Coffee beans stored on dry storage rack at entrance of kitchen. Person in charge removed strips.
6217807,FIRST WATCH RESTAURANT #190,3691 TAMPA RD,OLDSMAR,2024-08-15,1,Inspection Completed - No Further Action,False,False,
6217808,THE RUSTY LYON,923 BROADWAY,DUNEDIN,2026-04-08,9,Inspection Completed - No Further Action,True,False,"No plan review submitted and approved - renovations were made or are in progress. Must submit plans and plan review application to DBPR H and R Plan Review office located at 2601 Blair Stone Rd., Tallahassee, FL 32399-1011. Plans must be submitted AND approved within 60 days. The direct link to the…"
6217810,VERDUCCI,7800 BLIND PASS RD,ST PETE BEACH,2022-12-06,2,Inspection Completed - No Further Action,True,False,
6217811,GREEN MARKET CAFE,7839 113 ST STE C,SEMINOLE,2025-07-02,3,Inspection Completed - No Further Action,True,False,"Time/temperature control for safety food cold held at greater than 41 degrees Fahrenheit. Walk in cooler-cut melon (48F - Cold Holding); chicken (46F - Cold Holding), per manager, staff constantly in and out,"
6217815,THE PEARL RESTAURANT,5802 28 AVE  S,GULFPORT,2026-05-15,1,Warning Issued,False,False,
6217817,WILLIE JEWELL'S OLD SCHOOL BAR-B-Q LARGO,9040 ULMERTON RD STE 100,LARGO,2023-10-27,5,Warning Issued,True,False,
6217818,DUNKIN DONUTS,1100 TYRONE BLVD N,ST. PETERSBURG,2025-10-15,1,Inspection Completed - No Further Action,False,False,"Time/temperature control for safety food cold held at greater than 41 degrees Fahrenheit. Sausage patties (50F - Cold Holding); cream cheese (52F - Cold Holding) Operator says she uses Time as a Public Health Control for these items, put them out at 6AM, and planned to discard at 10AM. Items had no…"
6217820,THE GLASS NOODLE,681  CENTRAL AVE,ST PETERSBURG,2025-10-29,9,Warning Issued,True,False,"Live, small flying insects found Approximately: 20 live flies flying above and landing on rack storing soda syrup boxes with attached soda lines. 7 live flies landing on wooden shelf storing wine bottles across from soda machine in server wait station. 11 live flies landing on wine bottle, boxes of…"
6217822,HOPSCOTCH CAFE,1006 BROADWAY,DUNEDIN,2026-04-09,4,Inspection Completed - No Further Action,True,False,Establishment unable to be licensed at time of licensing inspection from the Division of Hotels and Restaurants. Operator must obtain a public food service license from the Division of Hotels and Restaurants within 60 days. Submit a license application and payment to DBPR/Bureau of Central Intake…
6217823,DUNKIN DONUTS,1821 N HIGHLAND AVE,CLEARWATER,2022-11-04,1,Inspection Completed - No Further Action,False,False,
6217824,FRESHII,1737 MAIN ST,DUNEDIN,2020-09-02,1,Inspection Completed - No Further Action,False,False,
6217825,MULLETS FISH CAMP AND MARKET,3901 6TH STREET S,ST. PETERSBURG,2026-04-09,4,Inspection Completed - No Further Action,True,False,
6217829,EVE'S FAMILY RESTAURANT,3150 TAMPA RD UNIT 9,OLDSMAR,2025-10-16,3,Inspection Completed - No Further Action,True,False,"Date marked combined ready-to-eat, time/temperature control for safety food not consumed/sold within 7 days of preparing/opening the earliest ready-to-eat time/temperature for safety ingredient. See stop sale. 2 pans of Chili 9/23/25, 1 pan of BBQ Pork 10/3/25, 2 Quiche Pies 9/28/25 and 10/2/25 , 1…"
6217830,PHILLY'S,1135 MISSOURI AVE N,LARGO,2026-05-04,3,Inspection Completed - No Further Action,True,False,"Employee personal items stored in or above a food preparation area, food, clean equipment and utensils, or single-service items. Employee phone on cutting board surface on cooks line."
6217832,CASA ITALIA RESTAURANT,2699 GULF BLVD,INDIAN ROCKS BEACH,2025-10-13,3,Inspection Completed - No Further Action,True,False,"Ready-to-eat, time/temperature control for safety food prepared onsite and held more than 24 hours not properly date marked. Babaganouj Masson 10/12/2025."
6217833,BELLEVIEW BANQUET KITCHEN,25 BELLEVIEW BLVD,BELLEAIR,2023-06-27,1,Inspection Completed - No Further Action,False,False,
6217836,GERMAN KNODLE,951 CENTRAL AVE,ST. PETERSBURG,2021-04-15,1,Inspection Completed - No Further Action,False,False,
6217839,PERRYS BBQ CAJUN GRILL,6901 22 AVE N SPACE #VC02,ST. PETERSBURG,2026-04-28,6,Inspection Completed - No Further Action,True,False,
6217840,UMAMI ENDLESS SUSHI & BAR LLC,3942 TYRONE BLVD N STE D,ST. PETERSBURG,2025-11-17,8,Warning Issued,True,False,Time/temperature control for safety food cold held at greater than 41 degrees Fahrenheit. Deli salad cooler - first one walk into kitchen. Karbala meat (53F - Cold Holding); tofu (54F - Cold Holding) employee moved all TCS products to glass cooler Internal thermometer stated danger zone
6217841,TACO MIENDO ST PETE,4747 66  ST  N,ST PETERSBURG,2026-04-30,17,Inspection Completed - No Further Action,True,False,Stop Sale issued on time/temperature control for safety food due to temperature abuse. Cooked beans (46F - Cold Holding); milk (51F - Cold Holding); crema (52F - Cold Holding); shredded mozzarella (51F - Cold Holding); carnitas (46F - Cold Holding); ground beef (48F - Cold Holding); chiles rellenos…
6217842,AROMA INDIAN CUISINE,351 WEST BAY DR,LARGO,2025-11-12,3,Warning Issued,True,False,"Ready-to-eat, time/temperature control for safety food prepared onsite and held more than 24 hours not properly date marked. Cooked chicken, fried cheese, fried vegetables."
6217843,OSTERIA BRICCO,7839F 113 ST STE F,SEMINOLE,2026-01-23,9,Inspection Completed - No Further Action,True,False,No currently certified food service manager on duty with four or more employees engaged in food preparation/handling. A list of accredited food manager certification examination providers can be found at http://www.myfloridalicense.com/DBPR/hotels-restaurants/food-lodging/food-manager/ Two kitchen…
6217844,ALTO MARE FISH BAR,"300 BEACH DRIVE NE, #124",ST PETERSBURTG,2021-04-07,1,Administrative complaint recommended,False,False,
6217846,ICE & CREAM CREAMERY,6807 GULF BLVD  UNIT A,ST.PETE BEACH,2020-07-20,1,Inspection Completed - No Further Action,False,False,
6217847,FLATBREAD & BUTTER,497 7 AVE N,ST. PETERSBURG,2026-03-20,4,Inspection Completed - No Further Action,True,False,"Required employee training expired for some employees. To order approved program food safety material, call DBPR contracted provider: Florida Restaurant and Lodging Association (SafeStaff) 866-372-7233. Observed employee training certificates for Paige A. Completion date of 5/12/2026 and Madison C.…"
6217848,SENOR SUBS & GYROS,1364 CLEVELAND ST,CLEARWATER,2026-01-09,5,Inspection Completed - No Further Action,True,False,Time/temperature control for safety food cold held at greater than 41 degrees Fahrenheit. -sliced cooked ham 46 F in the top section of the reach in cooler stored with a raised separator . Manager relocated food to freezer for quick chill downer recheck 43 F
6217851,PINEAPPLE ESPRESSO,3045 DR MARTIN LUTHER KING JR ST N,ST PETERSBURG ,2022-08-23,1,Administrative complaint recommended,False,False,
6217852,JOY ROCKWELL ENTERPRISES INC,2145 SUNNYDALE BLVD  BLDG 102,CLEARWATER,2026-04-17,4,Inspection Completed - No Further Action,True,False,"Employee personal items stored in or above a food preparation area, food, clean equipment and utensils, or single-service items. Employee purse , backpacks stored on shelf above boxes of gloves and cooking spray at cook line area . Employee items relocated"
6217853,BRYAN DONUTS LLC,8150 BRYAN DAIRY RD,PINELLAS PARK,2023-03-22,2,Inspection Completed - No Further Action,True,False,
6217855,OUTBACK STEAKHOUSE,7885 113TH STREET,SEMINOLE,2026-01-14,4,Inspection Completed - No Further Action,True,False,"Nonfood-contact surface soiled with grease, food debris, dirt, slime or dust. Cooler gaskets soiled Display monitors soiled over food on cook line"
6217858,WEPA LATIN FUSION,2149 3 AVE S UNIT 6,ST. PETERSBURG,2025-08-13,3,Inspection Completed - No Further Action,True,False,"Employee personal items stored in or above a food preparation area, food, clean equipment and utensils, or single-service items. Employee bag stored on shelf with can foods. Operator removed bag."
6217859,BRASS BOWL KITCHEN & JUICERY,656 CENTRAL AVE,ST. PETERSBURG,2020-12-07,2,Warning Issued,True,False,
6217860,KAIA BOWLS,"483 MANDALAY AVENUE, UNIT 107",CLEARWATER BEACH,2025-07-29,2,Inspection Completed - No Further Action,True,False,Time/temperature control for safety food thawed in an improper manner. Thawing frozen salmon and raw tuna at room temperature. Moved to reach in cooler.
6217862,CLEARWATER WINE BAR & BISTRO,482 POINSETTIA AVE,CLEARWATER,2025-09-26,1,Inspection Completed - No Further Action,False,False,Accumulation of black/green mold-like substance in the interior of the ice machine/bin.
6217863,NATURE'S TABLE,10200 9 ST N,ST. PETERSBURG,2021-06-11,2,Inspection Completed - No Further Action,True,False,
6217864,CHILE VERDE,4801 34 ST S,ST. PETERSBURG,2025-12-01,8,Inspection Completed - No Further Action,True,False,No proof provided that food employees are informed of their responsibility to report to the person in charge information about their health and activities related to foodborne illnesses. New employee employed for 20 day has not completed an employee health agreement. Manager provided employee with…
6217866,TANG'S CHICKEN,2001 GULF TO BAY BLVD #C,CLEARWATER,2026-04-07,5,Warning Issued,True,False,"Nonfood-contact surface soiled with grease, food debris, dirt, slime or dust. - soiled outer surface of tall reach in cooler and tall reach in freezer - soiled outer surfaces of bulk food container in back kitchen - soiled window sill at cook line"
6217868,PELICAN CLUB BISTRO KITCHEN,1501 INDIAN ROCKS RD,BELLEAIR,2026-05-08,4,Warning Issued,True,False,
6217870,IRISH 31 PUB HOUSE & EATERY,7724 113 ST N,SEMINOLE,2026-01-26,6,Inspection Completed - No Further Action,True,False,"Time/temperature control for safety food cold held at greater than 41 degrees Fahrenheit. Cook line - beer batter (55F - Cold Holding), staff added ice. Deli cooler across from stove - Swiss cheese (63F - Cold Holding); sliced tomatoes (57F - Cold Holding); mashed potatoes (58F - Cold Holding);…"
6217872,MEGA BURRITO,1474 GULF TO BAY BLVD A,CLEARWATER,2025-03-24,5,Warning Issued,True,False,
6217877,EINSTEIN BRO BAGELS,2216 66 ST N,ST. PETERSBURG,2025-11-17,1,Inspection Completed - No Further Action,False,False,Time/temperature control for safety food identified in the written procedure as a food held using time as a public health control has no time marking and the time removed from temperature control cannot be determined. See stop sale. Missing on raw shelled eggs and butter. Items time stamped for 6am.
6217878,TRY WINE,1 BEACH DRIVE SE #101,ST. PETERSBURG,2026-03-19,3,Call Back - Complied,True,False,"Time/temperature control for safety food packaged using a reduced oxygen method without a HACCP plan not properly labeled with the production time and date. Observed one vacuum sealed package with one link of chorizo, chicken, and bratwurst without a date. The operator stated the items were sealed…"
6217881,TROPICAL SMOOTHIE CAFE,40912 US HWY 19 N,TARPON SPRINGS,2025-12-01,2,Warning Issued,True,False,"Employee personal items stored in or above a food preparation area, food, clean equipment and utensils, or single-service items. Phone on prep table by walk in cooler. Operator moved To proper area"
6217882,BIRCHWOOD INN,340 BEACH DR NE,ST. PETERSBURG,2025-09-26,2,Inspection Completed - No Further Action,True,False,"Food-contact surface soiled with food debris, mold-like substance or slime. Can opener blade soiled with dried food debris. Food slicer soiled with dried food debris."
6217883,WINGSTOP,2090 GULF TO BAY BLVD,CLEARWATER,2026-03-04,5,Inspection Completed - No Further Action,True,False,Working containers of food removed from original container not identified by common name - bulk container of sugar at cook line. Manager placed a label on the container of sugar
6217884,FIRST WATCH RESTAURANT #289,2539 COUNTRYSIDE BLVD  STE 8,CLEARWATER,2025-08-12,1,Warning Issued,False,False,Working containers of food removed from original container not identified by common name. Squeeze bottles containing on cook line containing food removed from its original container not labeled with common name. Operator labeled container during inspection
6217885,NITALLY'S THAIMEX CUISINE,1163 DR MLK JR STREET,ST. PETERSBURG,2026-04-03,7,Inspection Completed - No Further Action,True,False,"- From initial inspection : Intermediate - No proof of required state approved employee training provided for any employees. To order approved program food safety material, call DBPR contracted provider: Florida Restaurant and Lodging Association (SafeStaff) 866-372-7233. No employee training could…"
6217887,CALABASH II,2319 CENTRAL AVE,ST. PETERSBURG,2025-10-23,2,Inspection Completed - No Further Action,True,False,- From initial inspection : Observed: Establishment operating without a license from the Division of Hotels and Restaurants. Operator must obtain a public food service license from the Division of Hotels and Restaurants within 60 days. Submit a license application and payment to DBPR/Bureau of…
6217890,THE SCREAMING JALAPENO,100 MAIN ST #109,SAFETY HARBOR,2021-01-05,2,Call Back - Admin. complaint recommended,True,False,
6217891,"DEWEY HOSPITALITY GROUP, LLC",109 8 AVE,ST PETE BEACH,2021-04-15,3,Warning Issued,True,False,
6217893,THE BIER BOUTIQUE,465 7  AVE  N,ST. PETESBURG,2026-03-18,3,Inspection Completed - No Further Action,True,False,Accumulation of black/green mold-like substance in the interior of the ice machine/bin. Interior of soda machine interior soiled with black mold.
6217894,SERAVALLI JULIE & ANDREW,28 MADONNA BLVD,TIERRA VERDE,2020-08-05,1,Call Back - Admin. complaint recommended,False,False,
6217895,FIRST WATCH RESTAURANTS #274,1345 4TH ST NORTH,ST. PETERSBURG,2025-11-06,2,Inspection Completed - No Further Action,True,False,Handwash sink used for purposes other than handwashing. Observed employee rinse plastic pitcher and dump the water out inside the hand sink at the end of cook line. Discussed with manager.
6217896,SOUL MEDITERRANEAN CUISINE,486 POINSETTIA  AVE,CLEARWATER BEACH,2026-05-14,1,Inspection Completed - No Further Action,False,False,
6217897,DUNKIN DONUTS / BASKIN ROBBINS,5602 GULFPORT BOULEVARD SOUTH,GULFPORT,2025-10-09,2,Inspection Completed - No Further Action,True,False,"Employee personal items stored in or above a food preparation area, food, clean equipment and utensils, or single-service items. Employee drinks stored on top shelf of walk in cooler. Operator moved to bottom shelf away from food."
6217899,WINGSTOP ST PETERSBURG FL,1411 34 STREET NORTH,ST. PETERSBURG,2023-02-20,2,Inspection Completed - No Further Action,True,False,
6217900,CHANNELS SEAFOOD MARKET,640 49TH STREET SOUTH,SAINT PETERSBURG,2026-05-04,2,Administrative complaint recommended,True,False,"Employee began working with food, handling clean equipment or utensils, or touching unwrapped single-service items without first washing hands. Observed employee begin work with no handwash. Inspector stopped employee and discussed proper handwashing. Employee washed hands."
6217901,CHARLEY'S PHILLY STEAKS,9080 ULMERTON RD,LARGO,2025-07-01,2,Warning Issued,True,False,"Proof of required state approved employee training not available for some employees. To order approved program food safety material, call DBPR contracted provider: Florida Restaurant and Lodging Association (SafeStaff) 866-372-7233. Tony Barsoum expired on 05-30-2025."
6217902,BABA ON CENTRAL,2701 CENTRAL AVE,ST. PETERSBURG,2026-05-06,5,Warning Issued,True,False,No currently certified food service manager on duty with four or more employees engaged in food preparation/handling. A list of accredited food manager certification examination providers can be found at http://www.myfloridalicense.com/DBPR/hotels-restaurants/food-lodging/food-manager/
6217903,THE CAMPUS GRIND LLC,121 7 AVE S STE 1,ST. PETERSBURG,2020-12-10,2,Call Back - Complied,True,False,
6217905,DATZ SAINT PETERSBURG,180 CENTRAL AVE,ST. PETERSBURG,2025-09-30,4,Inspection Completed - No Further Action,True,False,The chef on duty set up the three compartment sink with quaternary sanitizer that is testing at 200 PPM. - From follow-up inspection 2025-09-30: The chef on duty set up the three compartment sink with quaternary sanitizer that is testing at 200 PPM during callback inspection.
6217907,TOOTSIES SUGAR SHOP,10651 GULF BLVD,TREASURE ISLAND,2020-10-06,1,Inspection Completed - No Further Action,False,False,
6217909,HAMPTON INN BY HILTON DUNEDIN,2641 MICHAEL PLACE,DUNEDIN,2020-10-01,1,Warning Issued,False,False,
6217910,CLEAN JUICE,1804 4 ST N,ST PETERSBURG,2025-07-21,3,Warning Issued,True,False,Establishment has no written procedures for employees to follow in response to a vomiting or diarrheal event where the vomit or diarrhea is discharged onto surfaces in the establishment. Inspector will provide a procedure via email.
6217911,PROHIBITION KITCHEN AND TAP,1600 MAIN ST,DUNEDIN,2025-12-16,1,Warning Issued,False,False,"Accumulation of dead or trapped birds, insects, rodents, or other pests, in control devices. 9 dead flies in sticky traps in alcohol storage. 30 dead flies in sticky trap on bar next to soda gun. 30 dead flies in sticky trap next to 3 compartment sink in bar 20 dead flies in sticky trap on bar.…"
6217912,WINGSTOP,1925 W BRANDON BLVD,BRANDON,2021-03-09,2,Call Back - Complied,True,False,
6217915,SONDER SOCIAL CLUB,966 DOUGLAS AVE  UNIT 101,DUNEDIN,2020-11-18,1,Warning Issued,False,False,
6217916,COUSINS MAINE LOBSTER,309 CORONADO DR  UNIT B,CLEARWATER BEACH,2020-08-28,1,Warning Issued,False,False,
6217917,BUTTERMILK EATERY,10316 ROOSEVELT BLVD N,ST. PETERSBURG,2026-01-12,4,Warning Issued,True,False,"Time/temperature control for safety food identified in the written procedure as a food held using time as a public health control has no time marking and the time removed from temperature control cannot be determined. Egg palate on back, real butter, put time stamp on eggs."
6217918,POPPO'S TAQUERIA,1033 CENTRAL AVE,ST. PETERSBURG,2025-07-25,6,Warning Issued,True,False,- From initial inspection : Intermediate - No proof provided that two recently food employees are informed of their responsibility to report to the person in charge information about their health and activities related to foodborne illnesses. Hired less than 60 days ago. 1. Santiago 2. Becca - From…
6217919,KUNG FU TEA,7688 N 49TH STREET,PINELLAS PARK,2023-06-28,5,Inspection Completed - No Further Action,True,False,
6217920,THE FIT POKE STOP,10763  PARK BLVD NORTH,SEMINOLE,2026-01-08,5,Inspection Completed - No Further Action,True,False,"Raw fruits/vegetables not washed prior to preparation. Avocados in cooler at front counter with stickers, discussed proper washing of produce before preparation. Operator removed and washed during inspection"
6217921,BEACHWOOD SEAFOOD KITCHEN & BAR,4022 TAMPA RD,OLDSMAR,2026-04-03,5,Administrative complaint recommended,True,False,
6217922,BRIGHT ICE LLC,3701 5 AVE N,ST. PETERSBURG,2021-05-10,1,Inspection Completed - No Further Action,False,False,
6217926,FRESCA VIDA,"1757 CLEARWATER LARGO RD N,",CLEARWATER,2026-03-02,2,Inspection Completed - No Further Action,True,False,No proof provided that food employees are informed of their responsibility to report to the person in charge information about their health and activities related to foodborne illnesses. New hires Josefina and Satina hired just a few days ago. Emailed employee reporting agreement to operator and he…
6217928,WHISKEY WINGS,10400 ROOSEVELT BLVD,ST. PETERSBURG,2026-03-26,8,Inspection Completed - No Further Action,True,False,"Ready-to-eat, time/temperature control for safety food marked with a date that exceeds 7 days after opening/preparation. Vodka sauce in walk in cooler dated 3-16. Employee discarded Sweet hot sauce dated 3-6 Sweet mild sauce 3-10 sweet medium date on container 3-7 Wet through sauce recipe guide.…"
6217929,BELLAS BAGELS AND CAFE,7100 CENTRAL AVE,ST. PETERSBURG,2026-03-19,2,Inspection Completed - No Further Action,True,False,"Time/temperature control for safety food identified in the written procedure as a food held using time as a public health control has no time marking and the time removed from temperature control cannot be determined. See stop sale. Half and half (44F - Cold Holding) Operator voluntarily discarded,…"
6217930,SPEGGTACULAR,12125 INDIAN ROCKS RD,LARGO,2025-08-01,7,Inspection Completed - No Further Action,True,False,Roach activity present as evidenced by live roaches found. 1 live roach on shelf at counter 2 live roaches next to soda machine at front counter 1 live roach by coffee syrups at front counter 1 live roach under hand sink in kitchen 2 live roaches by cooler at end of cook line 3 live roaches end of…
6217931,VAN DOUGH,2519 MCMULLEN BOOTH RD  STE 207,CLEARWATER,2020-07-23,1,Warning Issued,False,False,
6217932,EMPANADA BROTHERS,9285 SEMINOLE BLVD,SEMINOLE,2022-12-16,1,Inspection Completed - No Further Action,False,False,
6217933,ICE & CREAM CREAMERY,10825  GULF BOULEVARD,TREASURE ISLAND,2025-08-13,2,Warning Issued,True,False,Establishment has no written procedures for employees to follow in response to a vomiting or diarrheal event where the vomit or diarrhea is discharged onto surfaces in the establishment. No clean up of vomiting and diarrheal events protocol. Provided protocol to employee.
6217934,CLYDE'S ORIGINAL CHOPHOUSE,2364 KEYSTONE RD,TARPON SPRINGS,2026-03-26,5,Inspection Completed - No Further Action,True,False,"Sanitizer bucket stored with food, equipment, utensils, linens, single-service, or single-use articles. In dining room , sanitizer bucket over napkins, operator moved bucket to bottom shelf."
6217935,CLEAN JUICE,2516 N MCMULLEN BOOTH RD STE A,CLEARWATER,2021-02-03,1,Inspection Completed - No Further Action,False,False,
6217936,YO! WHATS YOUR SCOOP?,6801 GULFPORT BLVD S,SOUTH PASADENA,2020-08-11,1,Warning Issued,False,False,
6217938,SOUL SICILIAN FUSION,516  CLEVELAND ST,CLEARWATER,2026-03-27,2,Inspection Completed - No Further Action,True,False,Commercially processed reduced oxygen packaged fish bearing a label indicating that it is to remain frozen until time of use no longer frozen and not removed from reduced oxygen package. Grouper at 51 F in ROP package . Reviewed with manager the thawing of seafood in ROP packaging . See stop sale…
