license,business_name,address,city,cit_latest_date,cit_ice_count,last_disposition,cit_repeat,cit_corrected_on_site,best_observation
6216220,CHILL RESTAURANT,363 COREY AVE,ST. PETE BEACH,2025-10-28,5,Inspection Completed - No Further Action,True,False,Floor tiles missing and/or in disrepair. Cooks line. Standing water on floor on cooks line.
6216222,MARCELA'S RESTAURANT INC,1623-A GULF TO BAY BLVD,CLEARWATER,2026-03-25,3,Warning Issued,True,False,No proof provided that some food employees are informed of their responsibility to report to the person in charge information about their health and activities related to foodborne illnesses.
6216225,OLD NORTHEAST PIZZERIA,718 2 ST N,ST. PETERSBURG,2021-03-05,1,Inspection Completed - No Further Action,False,False,
6216226,RUSSO'S NEW YORK PIZZERIA,2233 GULF TO BAY BLVD,CLEARWATER,2020-12-17,2,Inspection Completed - No Further Action,True,False,
6216232,CHIPOTLE MEXICAN GRILL-1041,1418 66 ST N,ST. PETERSBURG,2025-09-16,1,Inspection Completed - No Further Action,False,False,No written procedures available for use of time as a public health control to hold time/temperature control for safety food. I emailed paperwork to operator and he wrote up their plans.
6216235,JIMMYS SUSHI BAR JAPANESE LLC,5731 SEMINOLE BLVD,SEMINOLE,2026-01-27,7,Inspection Completed - No Further Action,True,False,"Commercially processed reduced oxygen packaged fish bearing a label indicating that it is to remain frozen until time of use no longer frozen and not removed from reduced oxygen package. Ground tuna, escolar and yellowfin tuna thawed in commercial packaging that specifies to remove before thawing.…"
6216240,ALSACE FRENCH BISTRO,1120 PINELLAS BAYWAY S #113-114,TIERRA VERDE,2021-06-01,1,Inspection Completed - No Further Action,False,False,
6216241,CHINA TASTE FL INC,876 E TARPON AVE,TARPON SPRINGS,2025-11-17,4,Inspection Completed - No Further Action,True,False,"Establishment advertised no MSG used in the food, but a large quantity of MSG was present in establishment. MSG chicken flavor soup based found in the dry storage area and in the cook line area. Operator states MSG is in the storage bin in dry storage area. Manager removed the word MSG on the menus."
6216242,TREASURE ISLAND YACHT & TENNIS CLUB OF PINELLAS COUNTY LLC,400 TREASURE ISLAND CAUSEWAY,TREASURE ISLAND,2023-03-29,3,Inspection Completed - No Further Action,True,False,
6216243,TREASURE ISLAND YACHT & TENNIS CLUB OF PINELLAS COUNTY LLC,400 TREASURE ISLAND CAUSEWAY,TREASURE ISLAND,2021-03-17,2,Inspection Completed - No Further Action,True,False,
6216247,SHELLS OF ST PETE BEACH,7081 GULF BLVD,ST.PETE BEACH,2024-02-08,3,Call Back - Complied,True,False,
6216254,TACO BELL,3401 5TH AVE N,ST. PETERSBURG,2025-07-31,3,Inspection Completed - No Further Action,True,False,Establishment has no written procedures for employees to follow in response to a vomiting or diarrheal event where the vomit or diarrhea is discharged onto surfaces in the establishment. Inspector will provide procedure prior to the end of inspection.
6216258,TIJUANA FLATS BURRITO CO,3687 TAMPA RD #203,OLDSMAR,2026-02-10,4,Inspection Completed - No Further Action,True,False,Employee with no hair restraint while engaging in food preparation. Employee making pizza in Bolger in preparation of food not using hair restraint or beard guard. Discussed the need to use hair restraint and beard guard when involved in food preparation.
6216261,CASA TINA MEXICAN GRILL,365 MAIN ST,DUNEDIN,2026-04-28,8,Inspection Completed - No Further Action,True,False,Spray bottle containing toxic substance not labeled. Quaternary spray bottle in bar area testing at 500+ PPM. Employee diluted chemical with water and quaternary is now testing at 200 PPM.
6216264,VILLAGE RESTAURANT,2525 GULF TO BAY BLVD,CLEARWATER,2021-02-09,1,Warning Issued,False,False,
6216265,ZEKOS MEDITERRANEAN GRILL,4880 54 AVE N,ST. PETERSBURG,2025-07-08,6,Administrative complaint recommended,True,False,Observed: Employee touching ready-to-eat food with their bare hands - food was not being heated as a sole ingredient to 145 degrees F or immediately added to other ingredients to be cooked/heated to the minimum required temperature to allow bare hand contact. Establishment has no approved…
6216273,PIA'S #2,3038 BEACH BLVD S,GULFPORT,2025-12-05,3,Inspection Completed - No Further Action,True,False,"Food being cooled by nonapproved method as evidenced by inadequate rate of cooling during time of inspection. -Polenta (123F - Cooling, retemped at 90F) Cooked at 3 PM. Cooling in a covered deep pan in walk in cooler. Operator uncovered and moved to blast chiller, retemped at 5 PM at 90F. Operator…"
6216274,FLAMESTONE AMERICAN GRILL,4009 TAMPA RD #4,OLDSMAR,2025-08-18,3,Call Back - Complied,True,False,"Time/temperature control for safety food cold held at greater than 41 degrees Fahrenheit. cream (50F - Cold Holding), cream was on the counter for less than 4 hours before placed in cooler. Unable to get second temperature."
6216275,RESIDENCE INN BY MARRIOTT,11908 GULF BLVD,TREASURE ISLAND,2026-03-31,2,Inspection Completed - No Further Action,True,False,Interior of oven/microwave has accumulation of black substance/grease/food debris. Interior of oven soiled with food debris.
6216277,NY EASTLAKE PIZZA,2525 EASTLAKE RD,PALM HARBOR,2026-01-23,8,Inspection Completed - No Further Action,True,False,- From initial inspection : Basic - Food storage container for time/temperature control for safety food not cleaned after being emptied prior to refilling. Squeeze bottles have a build up of grease around lid. Discussed with operator the need to clean squeeze bottles before refilling and as needed.…
6216283,METRO DINER,5250 4 ST N,ST. PETERSBURG,2026-03-11,7,Warning Issued,True,False,Time/temperature control for safety food cold held at greater than 41 degrees Fahrenheit. Cook line - egg wash (51F - Cold Holding); steak (64F - Cold Holding) Kitchen coolers - Swiss cheese (55F - Cold Holding); raw chicken (48F - Cold Holding); waffle batter (48F - Cold Holding); cut melon (56F -…
6216287,OLYMPIA BAKERY INCORPORATED,255 BEACH DR NE,ST. PETERSBURG,2021-05-11,1,Administrative complaint recommended,False,False,
6216288,EINSTEIN BROS BAGELS #3452,5395 E BAY DR STE 104,CLEARWATER,2025-08-28,4,Inspection Completed - No Further Action,True,False,Toxic substance/chemical improperly stored. Sanitation bucket stored on prep table next to clean equipment. Operator moved the sanitation bucket during inspection
6216296,BERLINS DOENER,4195 34 ST S,ST PETERSBURG,2026-01-22,3,Inspection Completed - No Further Action,True,False,Establishment has no written procedures for employees to follow in response to a vomiting or diarrheal event where the vomit or diarrhea is discharged onto surfaces in the establishment. Inspector will provide DBPR HR 5030-104 at the end of inspection.
6216298,ANGRY PEPPER WATERSIDE,4330 DUHME RD,MADEIRA BEACH,2026-02-10,8,Warning Issued,True,False,"Stop Sale issued due to food not being in a wholesome, sound condition. Commercially processed reduced oxygen packaged tuna in walk in cooler completely thawed, not removed from packaging. Staff discarded. Staff observed shredding chicken thighs and bagging smoked chicken wings on prep table in…"
6216299,ANGIES GRILL,1732 DREW ST,CLEARWATER,2022-08-19,3,Warning Issued,True,False,
6216302,BUBBA GUMP SHRIMP CO,185 BOARDWALK PL W,MADEIRA BEACH,2025-09-16,3,Warning Issued,True,False,"In-use utensil in non-time/temperature control for safety food not stored with handle above top of food within a closed container. Scoop handle in sugar bin, removed"
6216303,CUBAN & MEXICAN RESTAURANT,4016 ULMERTON RD,CLEARWATER,2025-09-24,3,Inspection Completed - No Further Action,True,False,Raw animal food stored over or with ready-to-eat food in a freezer - not all products commercially packaged. Raw beef over ready to eat French fries inside reach in freezer. Employee moved
6216306,TAQUITOS MEXICAN,9617 BAY PINES BLVD,ST PETERSBURG,2024-08-06,4,Inspection Completed - No Further Action,True,False,
6216307,LITTLE GREEK ULMERTON RESTAURANT,3700 ULMERTON RD #101,CLEARWATER,2025-09-02,5,Inspection Completed - No Further Action,True,False,No proof provided that food employees are informed of their responsibility to report to the person in charge information about their health and activities related to foodborne illnesses. Emailed filled out during inspection.
6216312,TROPICAL SMOOTHIE CAFE,2695 ROOSEVELT BLVD,CLEARWATER,2024-02-09,3,Inspection Completed - No Further Action,True,False,
6216314,BOARDWALK PIZZA AND GYROS,2547-1 COUNTRYSIDE BLVD,CLEARWATER,2021-02-02,2,Inspection Completed - No Further Action,True,False,
6216315,THE SWEET SPOT,2609 ALT 19 STE A,PALM HARBOR,2020-11-30,2,Call Back - Admin. complaint recommended,True,False,
6216322,SENOR TACO,6447 PARK BLVD STE# 1,PINELLAS PARK,2024-09-10,3,Emergency order recommended,True,False,
6216324,EASTERN KITCHEN AND SUSHI,5226 4 ST N,SAINT PETERSBURG,2024-08-28,3,Warning Issued,True,False,
6216331,JET'S PIZZA,9649 BAY PIINES BLVD,ST. PETERSBURG,2025-08-14,2,Inspection Completed - No Further Action,True,False,"Required employee training expired for some employees. To order approved program food safety material, call DBPR contracted provider: Florida Restaurant and Lodging Association (SafeStaff) 866-372-7233."
6216336,PERRY BBQ ASIAN GRILL,27001 US HWY 19 N SPACE # FC2,CLEARWATER,2026-04-29,5,Inspection Completed - No Further Action,True,False,"Ready-to-eat, time/temperature control for safety food prepared onsite and held more than 24 hours not properly date marked. Observed bus tubs of prepared food stored in reach in coolers not labeled at time of inspection."
6216340,CHINA WOK,1506 GULF TO BAY BLVD,CLEARWATER,2026-04-23,4,Inspection Completed - No Further Action,True,False,
6216341,THAI STAR SUSHI BAR,15229 GULF BLVD,MADEIRA BEACH,2026-02-24,7,Inspection Completed - No Further Action,True,False,No currently certified food service manager on duty with four or more employees engaged in food preparation/handling. A list of accredited food manager certification examination providers can be found at http://www.myfloridalicense.com/DBPR/hotels-restaurants/food-lodging/food-manager/ 4 employees…
6216343,MAD BEACH CANTINA,13205 GULF BLVD,MADEIRA BEACH,2026-01-12,5,Inspection Completed - No Further Action,True,False,"Required employee training expired for some employees. To order approved program food safety material, call DBPR contracted provider: Florida Restaurant and Lodging Association (SafeStaff) 866-372-7233. Some training certificates expired 1/5/26"
6216345,BASIL LEAF LLC,6395 GULF BLVD,ST.PETE BEACH,2026-04-27,7,Inspection Completed - No Further Action,True,False,"Ready-to-eat, time/temperature control for safety food prepared onsite and held more than 24 hours not properly date marked. Red sauce no date mark, fried tofu no date mark."
6216347,WESTSHORE PIZZA #16,6928 22 AVE N,ST. PETERSBURG,2026-02-17,2,Emergency order recommended,True,False,"Server handled soiled dishes or utensils and then picked up plated food, served food, or prepared a beverage without washing hands. -operator put dirty utensils from hand wash sink on side of prep table, other operator later grabbed a knife he claimed was clean from the top of those utensils and…"
6216351,T'ASIA SUSHI AND THAI,4648 PARK BLVD N,PINELLAS PARK,2026-04-02,5,Warning Issued,True,False,Commercially processed reduced oxygen packaged fish bearing a label indicating that it is to remain frozen until time of use no longer frozen and not removed from reduced oxygen package. I package of tuna inside ROP fully thawed in walk in cooler.
6216352,D'LITES OF ST PETE BEACH LLC,3629 49 STREET NORTH,ST. PETERSBURG,2020-10-01,1,Inspection Completed - No Further Action,False,False,
6216355,SPORTS SHACK,999 MISSOURI AVE N,LARGO,2020-07-06,1,Inspection Completed - No Further Action,False,False,
6216356,RENZO'S,104 2 ST S,ST. PETERSBURG,2026-05-06,5,Inspection Completed - No Further Action,True,False,"Operator is doing a special process, conducting reduced oxygen packaging, cooking time/temperature control for safety food to a time and temperature combination lesser than those in the Food Code or operating a molluscan shellfish tank for human consumption without a HACCP plan approved by the…"
6216358,SAUCED,1250 SEMINOLE BLVD,LARGO,2025-11-05,3,Inspection Completed - No Further Action,True,False,Dishmachine chlorine sanitizer not at proper minimum strength.
6216360,BURGER KING #16796,7930 US 19 N,PINELLAS PARK,2021-02-15,1,Inspection Completed - No Further Action,False,False,
6216363,GRILL & CAFE LUNA LLC,8421 49 ST N,PINELLAS PARK,2021-04-15,2,Inspection Completed - No Further Action,True,False,
6216367,SALEM'S FRESH EATS,880 34TH ST N,ST. PETERSBURG,2025-09-15,2,Emergency order recommended,True,False,Time/temperature control for safety food cold held at greater than 41 degrees Fahrenheit. Inside walk-in cooler Raw chicken gizzards - 50F Raw cut chicken - 50F Cooked gyro meat - 50F Temps taken at 10:30 AM. Manager stated he checked temperatures of cold holding units at 8 AM and temperatures were…
6216371,MANA MANA FALAFEL,530 PARK ST,CLEARWATER,2021-01-08,2,Emergency Order Callback Complied,True,False,
6216374,FIVE BUCKS DRINKERY,7402 49 ST,PINELLAS PARK,2026-01-21,4,Inspection Completed - No Further Action,True,False,Employee touching ready-to-eat food with their bare hands - food was not being heated as a sole ingredient to 145 degrees F or immediately added to other ingredients to be cooked/heated to the minimum required temperature to allow bare hand contact. Establishment has no approved Alternative…
6216377,JIMMY JOHN'S #1127,1410 66 ST,ST. PETERSBURG,2025-07-10,2,Inspection Completed - No Further Action,True,False,Accumulation of black/green mold-like substance in the interior of the ice machine/bin.interior ice chute on self service soda machine in dining room soiled with black mold like debris.
6216379,UPTOWN EATS,689 DR MLK JR ST N STE D,ST. PETERSBURG,2026-03-02,2,Inspection Completed - No Further Action,True,False,"Proof of required state approved employee training not available for some employees. To order approved program food safety material, call DBPR contracted provider: Florida Restaurant and Lodging Association (SafeStaff) 866-372-7233. Observed employee training certificate Lara S. Dated for 1/29/2025…"
6216383,FAIRFIELD INN AND SUITES ST PETERSBURG CLEARWATER,3211 EXECUTIVE DR,CLEARWATER,2023-11-01,2,Warning Issued,True,False,
6216385,BLACK CATTLE BURGER COMPANY,17 3 ST N,ST. PETERSBURG,2026-03-05,2,Inspection Completed - No Further Action,True,False,No proof provided that food employees are informed of their responsibility to report to the person in charge information about their health and activities related to foodborne illnesses. For one employee who is currently engaging in food preparation during the inspection and was hired 30 days ago.…
6216386,GOLDEN DINOSAURS VEGAN DELI,2930 BEACH BLVD S,GULFPORT,2021-01-25,2,Warning Issued,True,False,
6216388,FAYS DELI  AND SUBS,1538 16  ST S,ST. PETERSBURG,2026-03-10,4,Inspection Completed - No Further Action,True,False,"Employee handled soiled equipment or utensils and then engaged in food preparation, handled clean equipment or utensils, or touched unwrapped single-service items without washing hands. Employee touched dirty fan with gloves, removed gloves but did not wash hands before putting on new gloves."
6216392,NOVA535,535 DR MARTIN LUTHER KING JR ST N,ST. PETERSBURG,2021-05-05,1,Inspection Completed - No Further Action,False,False,
6216393,DA POLLANI'S,13688 WALSINGHAM RD,LARGO,2020-11-30,1,Inspection Completed - No Further Action,False,False,
6216401,LOS DOS PLEBES,14042 66TH ST STE A,LARGO,2025-11-25,1,Inspection Completed - No Further Action,False,False,Reach-in cooler on cooks line interior/shelves have accumulation of soil residues.
6216403,18 ON THE ROCKS,2405 GULF BLVD,INDIAN ROCKS BEACH,2020-09-09,1,Inspection Completed - No Further Action,False,False,
6216407,MIKE SUSHI,33855 US 19 N,PALM HARBOR,2026-04-22,4,Inspection Completed - No Further Action,True,False,"No plan review submitted and approved - renovations were made or are in progress. Must submit plans and plan review application to DBPR H and R Plan Review office located at 2601 Blair Stone Rd., Tallahassee, FL 32399-1011. Plans must be submitted AND approved within 60 days. The direct link to the…"
6216408,MAGGIE MAES ON THE BLUFFS,2961 WEST BAY DR,BELLEAIR BLUFFS,2025-10-27,2,Warning Issued,True,False,"Time/temperature control for safety food, other than whole meat roast, hot held at less than 135 degrees Fahrenheit. hash brown casserole 124f,"
6216411,THUY CAFE,5944 34 ST N #22,ST. PETERSBURG,2025-09-16,4,Inspection Completed - No Further Action,True,False,"Label on a food item prepared and packaged onsite for customer self-service does not include product identity/description, date product was packaged and name and address of the establishment that prepared and packaged the food. Establishment is utilizing a hold holding unit at front counter for…"
6216413,PAPA JOHNS PIZZA #805,3700 ULMERTON RD #103,CLEARWATER,2022-08-04,1,Inspection Completed - No Further Action,False,False,
6216415,MAHAFFEY THEATER,400 1 ST SOUTH,ST. PETERSBURG,2026-04-07,3,Administrative complaint recommended,True,False,"Food-contact surface soiled with food debris, mold-like substance or slime. Can opener blade soiled with dried food debris build up."
6216417,LATIN BOWL RESTAURANT,11500 WALSINGHAM RD,LARGO,2025-08-26,2,Call Back - Complied,True,False,No currently certified food service manager on duty with four or more employees engaged in food preparation/handling. A list of accredited food manager certification examination providers can be found at http://www.myfloridalicense.com/DBPR/hotels-restaurants/food-lodging/food-manager/ 5 employees…
6216418,AMC THEATRES WOODLANDS 20,3128 TAMPA RD,OLDSMAR,2025-07-08,2,Inspection Completed - No Further Action,True,False,Dishmachine chlorine sanitizer not at proper minimum strength.
6216420,THE AVENUE,330 1 AVE S,ST PETERSBURG,2023-10-17,5,Emergency order recommended,True,False,
6216421,SUPER SCOOPS,11025 GULF BLVD,TREASURE ISLAND,2026-03-31,2,Inspection Completed - No Further Action,True,False,"Proof of required state approved employee training not available for some employees. To order approved program food safety material, call DBPR contracted provider: Florida Restaurant and Lodging Association (SafeStaff) 866-372-7233. Sawyer Sanchez hired 1 year ago no employee training."
6216422,TOUCAN'S,431 MANDALAY AVE,CLEARWATER BEACH,2025-09-25,2,Inspection Completed - No Further Action,True,False,"Time/temperature control for safety food cold held at greater than 41 degrees Fahrenheit. Pulled chicken 53f, Cooked potatoes 52f, Alfredo 55f, Chowder 54f, Coleslaw 57f, Raw shrimp 55f, Raw tuna 52f, Raw fish 52f, all items in walk in cooler, repair called. Line-raw shell eggs 50f, move to lower…"
6216427,THE PIZZA JOINT FL,6723 49 ST N,PINELLAS PARK,2021-01-25,3,Administrative complaint recommended,True,False,
6216428,400 BEACH SEAFOOD & TAP HOUSE,400 BEACH DRIVE NE STE #120,ST. PETERSBURG,2025-09-30,4,Inspection Completed - No Further Action,True,False,Clam/mussel/oyster tags not maintained in chronological order according to the last date they were served in the establishment. Observed oyster tags not in chronological order.
6216430,YAMA TAIYO RESTAURANT,660 ALDERMAN RD,PALM HARBOR,2026-03-10,8,Administrative complaint recommended,True,False,- From initial inspection : Basic - Dead roaches on premises. 17 dead roaches in sticky trap by reach in freezer in back prep area. 1 dead roaches under shelves in dry storage. Operator removed trap and roaches and cleaned and sanitized area. - From follow-up inspection 2026-01-16: 2 dead roaches…
6216434,TROPICAL SMOOTHIE CAFE,150 FOUNTAIN PKWY N STE B,ST. PETERSBURG,2020-11-10,1,Inspection Completed - No Further Action,False,False,
6216435,ZEKOS PIZZERIA,2001 GULF TO BAY BLVD UNIT A,CLEARWATER,2022-07-19,4,Administrative complaint recommended,True,False,
6216437,R&S MARKET DELI PIZZERIA,2645 SR 590,CLEARWATER,2021-01-14,3,Call Back - Complied,True,False,
6216439,COMFORT INN NORTH,2260 54 AVE N,ST. PETERSBURG,2023-02-24,2,Inspection Completed - No Further Action,True,False,
6216440,KRISPY KRAB,3100 18TH AVE SOUTH,ST. PETERSBURG,2025-02-10,3,Inspection Completed - No Further Action,True,False,
6216448,THE NONA SLICE HOUSE,997 MAIN ST,SAFETY HARBOR,2026-03-09,2,Inspection Completed - No Further Action,True,False,No proof provided that some food employees are informed of their responsibility to report to the person in charge information about their health and activities related to foodborne illnesses.
6216454,EL GUERRERO MEXICAN GRILL INC,9727 66 ST N,PINELLAS PARK,2026-03-31,7,Inspection Completed - No Further Action,True,False,"Proof of required state approved employee training not available for some employees. To order approved program food safety material, call DBPR contracted provider: Florida Restaurant and Lodging Association (SafeStaff) 866-372-7233. One employee in kitchen with no proof of training"
6216459,FIRST WATCH RESTAURANTS #99,35146 US HWY 19 N,PALM HARBOR,2025-12-19,3,Inspection Completed - No Further Action,True,False,"Certified Food Manager or person in charge lacks knowledge of foodborne illnesses and symptoms of illness that would prevent an employee from working with food, clean equipment and utensils, and single-service items. Emailed provider Form HR 5030-100"
6216460,SWINGERS,2501 CENTRAL AVE,ST. PETERSBURG,2021-05-12,2,Warning Issued,True,False,
6216468,PACIFIC THAI CUISINE,4058 TAMPA RD STE 5,OLDSMAR,2021-02-22,2,Warning Issued,True,False,
6216474,DOORIBAN,5600 66 ST N,ST. PETERSBURG,2021-04-14,2,Inspection Completed - No Further Action,True,False,
6216476,MARCO'S PIZZA #8028,2508-D N MCMULLEN BOOTH RD,CLEARWATER,2020-11-25,2,Call Back - Complied,True,False,
6216477,LITTLE GREEK CUISINE,2245 GULF TO BAY BLVD,CLEARWATER,2026-05-06,4,Inspection Completed - No Further Action,True,False,
6216479,LOVEN PIZZA,2194A MAIN STREET,DUNEDIN,2021-01-13,2,Warning Issued,True,False,
6216484,KATERINA'S GREEK GRILL,619 N PINELLAS AVE,TARPON SPRINGS,2026-04-06,5,Inspection Completed - No Further Action,True,False,"No plan review submitted and approved - renovations were made or are in progress. Must submit plans and plan review application to DBPR H and R Plan Review office located at 2601 Blair Stone Rd., Tallahassee, FL 32399-1011. Plans must be submitted AND approved within 60 days. The direct link to the…"
6216485,STRACHAN'S HOMEMADE ICE CREAM & DESSERTS LLC,310 MAIN ST,DUNEDIN,2020-08-24,1,Inspection Completed - No Further Action,False,False,
6216489,INDIAN BISTRO,4785 GULF BLVD,ST.PETE BEACH,2025-12-08,3,Inspection Completed - No Further Action,True,False,"Ready-to-eat, time/temperature control for safety food prepared onsite and held more than 24 hours not properly date marked. Cooked lentils and various sauces in stand up next to stove. Cooked rice from 12/7/2025 reheating in rice cooker to be thrown away. Held overnight in cooker. Butter sauce…"
6216494,THE BOAT CLUB,819 BECKETT WAY,TARPON SPRINGS,2021-01-25,2,Warning Issued,True,False,
6216495,CAPTAINS PIZZA NORTH,483 MANDALAY AVE STE 106,CLEARWATER BEACH,2021-05-26,3,Call Back - Admin. complaint recommended,True,False,
6216496,HYATT REGENCY CLEARWATER BEACH RESORT AND SPA,301 GULFVIEW BLVD ,CLEARWATER ,2026-03-06,3,Inspection Completed - No Further Action,True,False,"Time/temperature control for safety food cold held at greater than 41 degrees Fahrenheit. Cream cheese 67f, butter 65f, buffet area. Dice ham 50f, diced sausage 51f, goat cheese 52f, feta 51f, cooks line. All items added to TPHC."
6216500,TROPICAL SMOOTHIE CAFE,1001 WEST BAY DR STE #102,LARGO,2025-07-14,1,Inspection Completed - No Further Action,False,False,"Food-contact surface soiled with food debris, mold-like substance or slime."
6216502,BRADYS BBQ,340 MAIN ST,SAFETY HARBOR,2021-03-18,5,Call Back - Complied,True,False,
6216511,ANGELO'S,536 1 AVE N,ST. PETERSBURG,2026-01-21,7,Inspection Completed - No Further Action,True,False,No mop sink or curbed cleaning facility provided at establishment. Plans on file dated 1/6/2017 indicate a mop sink should be located in the rear storage area. No mop sink was observed. Capped water lines were observed protruding from the wall where the mop sink is shown on the plans. The person in…
6216515,HYATT REGENCY CLEARWATER BEACH RESORT & SPA,301 GULF VIEW BLVD,CLEARWATER,2021-04-07,2,Inspection Completed - No Further Action,True,False,
6216516,ANNATA WINE BAR,300 BEACH DRIVE NE,ST. PETERSBURG,2020-10-07,2,Administrative complaint recommended,True,False,
6216520,ASIAN WOK TAKE-OUT RESTAURANT,202 37 AVE N,ST. PETERSBURG,2025-09-15,6,Call Back - Complied,True,False,Raw animal foods not properly separated from one another based upon minimum required cooking temperature when stored in a freezer - not all products commercially packaged. Raw chicken stored above raw beef in the walk in freezer speed racks. Discussed with manager to relocate items. Raw animal…
6216522,SOUTH BEACH PAVILION,1 CAUSEWAY BLVD,DUNEDIN,2026-04-09,3,Inspection Completed - No Further Action,True,False,No handwashing sign provided at a hand sink used by food employees. Missing at hand sink next to two compartment utility sink across from walk in cooler. Inspector provided sign that was posted during the inspection.
6216523,BLISS COOKHOUSE,2710 ALT 19 STE 101,PALM HARBOR,2026-04-09,5,Inspection Completed - No Further Action,True,False,Employee failed to wash hands before putting on gloves to initiate a task working with food. Observed employee changing gloves from raw to ready to eat foods with no hand wash. Coached employee on proper hand washing procedures.
